ITEM_ID,ITEM_NAME,BRAND,L1_CATEGORY,L2_CATEGORY,L3_CATEGORY,COMPANY,SUPPLY_TYPE,SEGMENT,TAX_RATE
286776,"Nat Habit Hibiscus Amla Hair Oil For Hair Growth, 100% Natural, Hibiscus Shampoo For Long & Thick Hair, 100% Natural, Sulphate & Paraben Free And Hibiscus Conditioner For Smooth & Silky Hair",Nat Habit,Bath Body And Hair,Hair Oil And Serum,Ayurvedic Hair Oil,Naturohabit Pvt. Ltd,WH - Ambient,KnS,5
141284,"Nat Habit Rosemary Shampoo For Hairfall Control-Sulphate Habit Anti-Hair Fall Rosemary Conditioner For Women & Men, Paraben-Free",Nat Habit,Bath Body And Hair,Shampoo And Conditioner,Shampoo,Naturohabit Pvt. Ltd,WH - Ambient,KnS,18
304045,"Nat Habit Hibiscus Shampoo For Long & Thick Hair, 100% Natural, Sulphate & Paraben Free And Hibiscus Conditioner For Smooth & Silky Hair",Nat Habit,Bath Body And Hair,Shampoo And Conditioner,Shampoo,Naturohabit Pvt. Ltd,WH - Ambient,KnS,18
692165,"Nat Habit Rosemary Hair Oil For Hairfall Control, Rosemary Shampoo For Hairfall Control-Sulphate Free And Anti-Hair Fall Rosemary Conditioner For Women & Men, Paraben-Free",Nat Habit,Bath Body And Hair,Hair Oil And Serum,Ayurvedic Hair Oil,Naturohabit Pvt. Ltd,WH - Ambient,KnS,18
960895,Tulips Cotton Ear Buds/ Swabs Paper,Tulips,Makeup,Makeup Brushes And Tools,Cotton Balls And Pads,Pichai Home Care,WH - Ambient,KnS,5
557619,Tulips Multicolor Cotton Balls,Tulips,Makeup,Makeup Brushes And Tools,Cotton Balls And Pads,Pichai Home Care,WH - Ambient,KnS,5
438856,Tulips White Cotton Ball,Tulips,Makeup,Makeup Brushes And Tools,Cotton Balls And Pads,Pichai Home Care,WH - Ambient,KnS,5
740895,Tulips Cotton Ear Buds/ Swabs paper In Box,Tulips,Makeup,Makeup Brushes And Tools,Cotton Balls And Pads,Pichai Home Care,WH - Ambient,KnS,5
663006,Axe Signtr Body Perfume Intense,Axe,Bath Body And Hair,"Perfumes, Deos And Talc",Perfumes,Unilever International,WH - Ambient,KnS,18
695969,"Vaseline Intensive Care Cocoa Radiant Body Oil, With100% Pure Cocoa Butter",Vaseline,Bath Body And Hair,Grooming Accessories,Body Oils,Unilever International,WH - Ambient,KnS,18
471486,"Vaseline Intensive Care Coconut Restore Body Oil, For Long-Lasting Radiant Glow",Vaseline,Bath Body And Hair,Grooming Accessories,Body Oils,Unilever International,WH - Ambient,KnS,18
778392,Rexona Powder Dry Underarm Roll-On Deodorant For Women,Rexona,Bath Body And Hair,"Perfumes, Deos And Talc",Talcum Powder,Unilever International,WH - Ambient,KnS,18
222623,Axe Signtr Body Perfume Mysterious,Axe,Bath Body And Hair,"Perfumes, Deos And Talc",Perfumes,Unilever International,WH - Ambient,KnS,18
440429,Irish Spring Charcoal Refresh Moisturizing Face + Body Wash,Irish Spring,Bath Body And Hair,Shower Gel,Body Wash,Food Square,WH - Ambient,KnS,18
100832,"Biolage Smoothproof Smooth Hair Kit – Shampoo, Conditioner",Biolage,Bath Body And Hair,Shampoo And Conditioner,Shampoo,L'oreal India Pvt Ltd,WH - Ambient,KnS,5
301650,Irish Spring Moisturebody Wash Reset,Irish Spring,Bath Body And Hair,Shower Gel,Body Wash,Food Square,WH - Ambient,KnS,18
535994,Faces Canada Nail Enamel Remover - Transparent 01 | Vitamin E & Faces Canada Ultime Pro Splash Nail Enamel - Floral Dream 56 Glossy,Faces Canada,Makeup,Nail Paints And Accessories,Nail Polish Remover,Faces Cosmetics India Pvt. Ltd,WH - Ambient,KnS,18
965259,Faces Canada Liquid Sindoor - Red & Liquid Sindoor - Maroon,Faces Canada,Makeup,Face Makeup,Sindoor,Faces Cosmetics India Pvt. Ltd,WH - Ambient,KnS,18
481875,Gillette Fusion Manual Shaving Blades For Men,Gillette,Beauty And Grooming,Shaving Needs,Cartridge,Procter & Gamble,WH - Ambient,KnS,18
709645,Bombay Shaving Company Shave Fitkari Bar And Bombay Shaving Company Flexi Stud Razor (Pack Of 5),Bombay Shaving Company,Beauty And Grooming,Shaving Needs,Shaving Kit,Visage Lines Personal Care Pvt. Ltd.,WH - Ambient,KnS,5
248986,Bombay Shaving Company Sensi Smart 3 Razor Cartridge,Bombay Shaving Company,Beauty And Grooming,Shaving Needs,Cartridge,Visage Lines Personal Care Pvt. Ltd.,WH - Ambient,KnS,5
557445,Bombay Shaving Company Shave Fitkari Bar And Bombay Shaving Company Sensi Smart 3 Razor,Bombay Shaving Company,Beauty And Grooming,Shaving Needs,Shaving Kit,Visage Lines Personal Care Pvt. Ltd.,WH - Ambient,KnS,5
649288,Bombae Post Shave Balm (Ice Jelly) And Bombae Reusable Face Razor,Bombae,Beauty And Grooming,Shaving Needs,After Shave Lotion,Visage Lines Personal Care Pvt. Ltd.,WH - Ambient,KnS,5
848192,Bombae Flexi Disposable Body Razor,Bombae,Beauty And Grooming,Hair Removal,Razor,Visage Lines Personal Care Pvt. Ltd.,WH - Ambient,KnS,5
800741,"Skinside Hydrogel Under Eye Patches With Hyaluronic, Niacinamide & Caffeine",Skinside,Beauty And Grooming,Eye Care,Under Eye Cream,Sri Jain Pharmacy,WH - Ambient,KnS,18
492179,Azah Midstream Pregnancy Test Kit | Rapid Single-Step Pregnancy Test | 99% Accurate Results In 3 Minutes | Set Of 1,Azah,Hygiene And Wellness,Basic Pharma,Pregnancy Test Kit,Ph91 Consumer Goods India Private Limited,WH - Ambient,KnS,5
208903,Bombay Shaving Company Perfume Little Beach,Bombay Shaving Company,Bath Body And Hair,"Perfumes, Deos And Talc",Perfumes,Visage Lines Personal Care Pvt. Ltd.,WH - Ambient,KnS,18
657691,Bombay Shaving Company Perfume Toxic Fruit,Bombay Shaving Company,Bath Body And Hair,"Perfumes, Deos And Talc",Perfumes,Visage Lines Personal Care Pvt. Ltd.,WH - Ambient,KnS,18
898591,Plum Calendula & 10% Vitamin C Barrier Boosting + Glow Serum | Boosts Glow,Plum,Bath Body And Hair,Serums,Face Serum,Pureplay Skin Sciences (India) Pvt. Ltd.,WH - Ambient,KnS,18
306616,Faces Canada Strobe Cc Tint Mini - Sunset Glaze 02| Bb/Cc Cream & Highlighter,Faces Canada,Makeup,Face Makeup,Cc Cream,Faces Cosmetics India Pvt. Ltd,WH - Ambient,KnS,18
864213,Faces Canada Strobe Cc Tint Mini - Paradise Vibes 01| Bb/Cc Cream & Highlighter,Faces Canada,Makeup,Face Makeup,Cc Cream,Faces Cosmetics India Pvt. Ltd,WH - Ambient,KnS,18
566209,Faces Canada Strobe Cc Tint Mini - Twilight Veil 03| Bb/Cc Cream & Highlighter,Faces Canada,Makeup,Face Makeup,Cc Cream,Faces Cosmetics India Pvt. Ltd,WH - Ambient,KnS,18
796107,Faces Canada Swipe & Shine Nail Polish Remover Wipes - Lemon| Quick & Effortless,Faces Canada,Makeup,Nail Paints And Accessories,Nail Polish Remover,Faces Cosmetics India Pvt. Ltd,WH - Ambient,KnS,5
503034,Blue Heaven Spookie But Pookie Makeup Sponge Powder Puff,Blue Heaven,Makeup,Makeup Brushes And Tools,Sponges And Beauty Blenders,Esme Consumer Pvt. Ltd.,WH - Ambient,KnS,5
137736,Enchanteur Bath & Body Gift Set,Enchanteur,Bath Body And Hair,Gift Packs,Personal Care Gift,Wipro Enterprises Pvt Ltd,WH - Ambient,KnS,18
493468,Envy Aqua Marine Long Lasting Roll-On Deodorant,Envy,Bath Body And Hair,"Perfumes, Deos And Talc",Deos,Hamilton Sciences Pvt Ltd,WH - Ambient,KnS,18
462135,Mcaffeine Guava Tini De-Tan Body Wash,Mcaffeine,Bath Body And Hair,Shower Gel,Body Wash,Pep Technologies Pvt. Ltd.,WH - Ambient,KnS,18
995244,Denver Pride Edp Perfume,Denver,Bath Body And Hair,"Perfumes, Deos And Talc",Perfumes,Hamilton Sciences Pvt Ltd,WH - Ambient,KnS,18
625663,Denver Caliber Edp Perfume,Denver,Bath Body And Hair,"Perfumes, Deos And Talc",Perfumes,Hamilton Sciences Pvt Ltd,WH - Ambient,KnS,18
300501,Denver Gentlemen Collection Magnus Perfume (For Men),Denver,Bath Body And Hair,"Perfumes, Deos And Talc",Perfumes,Hamilton Sciences Pvt Ltd,WH - Ambient,KnS,18
105041,Denver Hamilton And Pride Perfume Eau De Parfum (For Men),Denver,Bath Body And Hair,"Perfumes, Deos And Talc",Perfumes,Hamilton Sciences Pvt Ltd,WH - Ambient,KnS,5
611999,Denver Hamilton Exclusive Collection Gift Set (For Men),Denver,Bath Body And Hair,"Perfumes, Deos And Talc",Perfumes,Hamilton Sciences Pvt Ltd,WH - Ambient,KnS,5
323199,Palmer's Coconut Conditioning Oil Shampoo,Palmers,Bath Body And Hair,Shampoo And Conditioner,Conditioner,Food Square,WH - Ambient,KnS,5
444413,Bombay Shaving Company Desire Deodorant Spray And Bombay Shaving Company Noir Deodorant Spray,Bombay Shaving Company,Bath Body And Hair,"Perfumes, Deos And Talc",Deos,Visage Lines Personal Care Pvt. Ltd.,WH - Ambient,KnS,5
810257,Bombay Shaving Company Perfume Stamped & Scented Kit,Bombay Shaving Company,Bath Body And Hair,"Perfumes, Deos And Talc",Perfumes,Visage Lines Personal Care Pvt. Ltd.,WH - Ambient,KnS,18
908823,"Puramio Rose Water, Pack Of 2(500ml Each)",Puramio,Bath Body And Hair,Face And Lip Care,Face Care,Puramio India Private Limited,WH - Ambient,KnS,18
307582,Tresemme Keratin Smooth Hair Mask With Argan Oil,Tresemme,Bath Body And Hair,Shampoo And Conditioner,Hair Mask,Hindustan Unilever Limited,WH - Ambient,KnS,18
548872,L'oreal Paris Casting Crème Gloss Alia's Favourite Shade,L'oreal Paris,Beauty And Grooming,Hair Colour,Creme Hair Colour,L'oreal India Pvt Ltd,WH - Ambient,KnS,18
113178,L'oreal Paris Casting Crème Gloss Hair Color With Glycolic Gloss Complex |Alia's Favourite Shade,L'oreal Paris,Beauty And Grooming,Hair Colour,Creme Hair Colour,L'oreal India Pvt Ltd,WH - Ambient,KnS,18
563775,Gn 1917 Blue Serenity - Premium Eau De Parfume,Gn 1917,Bath Body And Hair,"Perfumes, Deos And Talc",Perfumes,Tprg Fragrances Private Limited,WH - Ambient,KnS,18
401659,Gn 1917 Green Harmony - Premium Eau De Parfume,Gn 1917,Bath Body And Hair,"Perfumes, Deos And Talc",Perfumes,Tprg Fragrances Private Limited,WH - Ambient,KnS,18
312338,"Volini Headache Relief Roll-On| Instant, Non-Greasy Relief",Volini,Hygiene And Wellness,Wound Care And Pain Relief,Topical Pain Relief,Sun Pharmaceutical Industries Ltd.,WH - Ambient,KnS,5
387501,Pee Safe Toilet Seat Sanitizer Spray (Lavender),Pee Safe,Hygiene And Wellness,Feminine Hygiene,Intimate Wipes And Wash,Redcliffe Hygiene Private Limited,WH - Ambient,KnS,18
954525,Pee Safe Toilet Seat Sanitizer Spray (Mint),Pee Safe,Hygiene And Wellness,Feminine Hygiene,Intimate Wipes And Wash,Redcliffe Hygiene Private Limited,WH - Ambient,KnS,18
652489,"Enn Beauty Shringar Kit ( Lipstick, Nail Paint, Mehndi, Bindi & Sindoor )",Enn Beauty,Makeup,Gift Set,Makeup Kit,Nvikk Beauty Private Limited,WH - Ambient,KnS,18
509291,Prolume Nail Filer 2-In-1 Manicure & Pedicure Tool,Prolume,Makeup,Makeup Brushes And Tools,Nail Filer,Redroomtechnology Private Limited,WH - Ambient,KnS,18
180068,Plum Bodylovin' Pocket Diary Perfume Discovery Set,Plum,Bath Body And Hair,"Perfumes, Deos And Talc",Perfumes,Pureplay Skin Sciences (India) Pvt. Ltd.,WH - Ambient,KnS,18
684755,French Essence Deodorant And Perfume Combo For Women Gift Set For Her,French Essence,Bath Body And Hair,"Perfumes, Deos And Talc",Perfumes,Spectra Care Pvt Ltd,WH - Ambient,KnS,18
894956,French Essence Luxury Charm & Triumph Perfume Gift Set Eau De Parfum,French Essence,Bath Body And Hair,"Perfumes, Deos And Talc",Perfumes,Spectra Care Pvt Ltd,WH - Ambient,KnS,18
447343,French Essence Deodorant And Perfume Combo For Men Gift Set For Him,French Essence,Bath Body And Hair,"Perfumes, Deos And Talc",Perfumes,Spectra Care Pvt Ltd,WH - Ambient,KnS,18
869634,French Essence Luxury Bloom & Oud Perfume Gift Set Eau De Parfum,French Essence,Bath Body And Hair,"Perfumes, Deos And Talc",Perfumes,Spectra Care Pvt Ltd,WH - Ambient,KnS,18
423189,Bare Necessities Diwali Gratitude Gift Set For Men & Women | Festive Gift Box,Bare Necessities,Bath Body And Hair,Gift Packs,Personal Care Gift,Bare Necessities Zero Waste Solutions Pvt Ltd,WH - Ambient,KnS,5
122976,Bare Necessities Diwali Joyful Celebration Gift Set | Premium Brown & Gold Gift Box,Bare Necessities,Bath Body And Hair,Gift Packs,Personal Care Gift,Bare Necessities Zero Waste Solutions Pvt Ltd,WH - Ambient,KnS,5
896255,"Maybelline New York Sunkisser Hazy Matte Blush,12h Sunkissed Cheeks, Hot Sunset",Maybelline New York,Makeup,Face Makeup,Blush,L'oreal India Pvt Ltd,WH - Ambient,KnS,18
901708,"Maybelline New York Sunkisser Hazy Matte Blush,12h Sunkissed Cheeks, Coastal Crush",Maybelline New York,Makeup,Face Makeup,Blush,L'oreal India Pvt Ltd,WH - Ambient,KnS,18
519896,"Maybelline New York Sunkisser Hazy Matte Blush,12h Sunkissed Cheeks, Rose Burst",Maybelline New York,Makeup,Face Makeup,Blush,L'oreal India Pvt Ltd,WH - Ambient,KnS,18
832212,Tnw The Natural Wash Longstay Powdery Mousse Semi Matte Lipstick Main Character - 02 Nude,Tnw The Natural Wash,Makeup,Lip Makeup,Lipsticks,Mpg Brands Private Limited,WH - Ambient,KnS,18
669749,Tnw The Natural Wash Longstay Powdery Mousse Semi Matte Lipstick Top Notch - 01 Light Nude,Tnw The Natural Wash,Makeup,Lip Makeup,Lipsticks,Mpg Brands Private Limited,WH - Ambient,KnS,18
335156,Faces Canada Ultime Pro Splash Mini Nail Combo Pink Pop,Faces Canada,Makeup,Nail Paints And Accessories,Nail Polish,Faces Cosmetics India Pvt. Ltd,WH - Ambient,KnS,18
699127,Faces Canada Ultime Pro Splash Mini Nail Combo Pastel Paradise,Faces Canada,Makeup,Nail Paints And Accessories,Nail Polish,Faces Cosmetics India Pvt. Ltd,WH - Ambient,KnS,18
760915,Faces Canada Ultime Pro Splash Mini Nail Combo Vintage Vibes,Faces Canada,Makeup,Nail Paints And Accessories,Nail Polish,Faces Cosmetics India Pvt. Ltd,WH - Ambient,KnS,18
904094,Tnw The Natural Wash Longstay Powdery Mousse Semi Matte Lipstick Flirt Alert - 04pink Brown,Tnw The Natural Wash,Makeup,Lip Makeup,Lipsticks,Mpg Brands Private Limited,WH - Ambient,KnS,18
109403,Tnw The Natural Wash Longstay Powdery Mousse Semi Matte Lipstick Boss Energy - 03 Brown,Tnw The Natural Wash,Makeup,Lip Makeup,Lipsticks,Mpg Brands Private Limited,WH - Ambient,KnS,18
878282,Tnw The Natural Wash Longstay Powdery Mousse Semi Matte Lipstick Crushin'it - 05 Dark Brown,Tnw The Natural Wash,Makeup,Lip Makeup,Lipsticks,Mpg Brands Private Limited,WH - Ambient,KnS,18
288266,Kimirica Love Story Moment Gift Set & Kimirica The Gulistan Bath And Body Care Duo,Kimirica,Bath Body And Hair,Gift Packs,Personal Care Gift,Kimirica Lifestyle Private Limited,WH - Ambient,KnS,18
675222,Bella Vita Luxury Ceo Man Eau De Parfum Office Wear For Men With Long Lasting Fragrance & Bella Vita Luxury Fresh Unisex Perfume For Men & Women With Woody Aquatic Scent Fragrance,Bella Vita Organic,Bath Body And Hair,"Perfumes, Deos And Talc",Perfumes,Idam Naturals Wellness Pvt Ltd,WH - Ambient,KnS,18
875293,Fiama Shower Gel Peach & Avocado Body Wash With Skin Conditioners For Soft Moisturised Skin Npump & Fiama Happy Naturals Shower Gel Plum Blossom And Ylang 97% Natural Skin Conditioners Bodywash,Fiama,Bath Body And Hair,Shower Gel,Fragrance Shower Gel,Itc Limited,WH - Ambient,KnS,18
550043,Bare Necessities Round The Clock Solid Deodorant|Refreshing Earthy Fragrance & Bare Necessities Gentleman Care Hamper|Sustainable Self-Care For The Modern Men,Bare Necessities,Bath Body And Hair,"Perfumes, Deos And Talc",Deos,Bare Necessities Zero Waste Solutions Pvt Ltd,WH - Ambient,KnS,18
933959,Jaivik Farms Castor Oil,Jaivik Farms,Bath Body And Hair,Hair Oil And Serum,Other Hair Oil,Food Square,WH - Ambient,KnS,5
248436,Khadi Natural Tulsi Herbal Hair Oil|Hair Oil For Hair Fall |Non-Sticky Hair Oil For Dry Scalp | Paraben & Mineral Oil Free | Suitable For All Hair Types & Khadi Natural Rosemary & Henna Hair Oil,Khadi Natural,Bath Body And Hair,Hair Oil And Serum,Functional Hair Oil,Khadi Natural Healthcare,WH - Ambient,KnS,18
724114,Aqualogica Detan+ Dewy Sunscreen Spf 50+ With Cherry Tomato And Hyaluronic Acid | Pa++++ & The Derma Co 1% Hyaluronic Long Lasting Sunscreen Acid Vitamin E Spf 50 Pa++++,Aqualogica,Bath Body And Hair,Face Cream,Sunscreen,Honasa Consumer Pvt Ltd,WH - Ambient,KnS,18
360760,Wild Stone Ultra Sensual Perfume & Wild Stone Hydra Energy Perfume,Wild Stone,Bath Body And Hair,"Perfumes, Deos And Talc",Perfumes,Mcnroe Consumer Products Pvt Ltd,WH - Ambient,KnS,18
412665,Secret Temptation Dream Eau De Parfum For Women |Premium Luxury Perfume & Wild Stone Ultra Sensual Perfume,Secret Temptation,Bath Body And Hair,"Perfumes, Deos And Talc",Roll Ons,Mcnroe Consumer Products Pvt Ltd,WH - Ambient,KnS,18
303118,"Beardo Ultra Glow Body Wash|Brightens Skin Tone|Removes Dirt & Dead Cell & Beardo De-Tan Body Wash For Men, Tan Removal And Caffeine |Coffee & Aloe Extracts",Beardo,Bath Body And Hair,Shower Gel,Men Shower Gel,Zed Lifestyle Private Limited,WH - Ambient,KnS,18
455188,"Beardo De-Tan Body Wash For Men, Tan Removal And Caffeine |Coffee & Aloe Extracts & Beardo De-Tan Body Wash For Men, | Tan Removal And Caffeine Body Wash | Detan With Coffee & Aloe Extracts | For Body & Face | Refreshing Fragrance",Beardo,Bath Body And Hair,Shower Gel,Men Shower Gel,Zed Lifestyle Private Limited,WH - Ambient,KnS,18
101685,"Engage Verona Perfume For Women, Long Lasting & Engage Gift Luxury Perfume Gift Set For Women, Travel Sized, Long Lasting Fragrance By Itc",Engage,Bath Body And Hair,"Perfumes, Deos And Talc",Perfumes,Itc Limited,WH - Ambient,KnS,18
296737,Bodify Niacinamide & Pro Vitamin B5 Body Wash & Bodify Bamboo Charcoal Body Wash,Bodify,Bath Body And Hair,Shower Gel,Refresh Shower Gel,Pittie Consumer Pvt. Ltd.,WH - Ambient,KnS,18
684641,Bodify Lemon & Rosemary Soap & Bodify Aloe Vera & Cucumber Body Wash,Bodify,Bath Body And Hair,Soap,Freshness Soap,Pittie Consumer Pvt. Ltd.,WH - Ambient,KnS,18
674508,Bodify Cherry & Almond Soap & Bodify Lavender & Mint Soap,Bodify,Bath Body And Hair,Soap,Freshness Soap,Pittie Consumer Pvt. Ltd.,WH - Ambient,KnS,18
544107,Bodify Niacinamide & Pro Vitamin B5 Body Wash & Bodify Marine Extract Body Wash - 250ml,Bodify,Bath Body And Hair,Shower Gel,Refresh Shower Gel,Pittie Consumer Pvt. Ltd.,WH - Ambient,KnS,18
574130,Bodify Marine Extract Body Wash - 250ml & Bodify Aloe Vera - Multipurpose Gel,Bodify,Bath Body And Hair,Shower Gel,Refresh Shower Gel,Pittie Consumer Pvt. Ltd.,WH - Ambient,KnS,18
263672,Bodify Bamboo Charcoal Body Wash & Bodify Niacinamide & Pro Vitamin B5 Body Wash,Bodify,Bath Body And Hair,Shower Gel,Refresh Shower Gel,Pittie Consumer Pvt. Ltd.,WH - Ambient,KnS,18
127536,Bodify Lavender & Mint Soap & Bodify Sandalwood & Neroli Soap,Bodify,Bath Body And Hair,Soap,Freshness Soap,Pittie Consumer Pvt. Ltd.,WH - Ambient,KnS,18
905121,Bodify Sandalwood & Neroli Soap & Bodify Strawberry Passion Soap,Bodify,Bath Body And Hair,Soap,Freshness Soap,Pittie Consumer Pvt. Ltd.,WH - Ambient,KnS,18
899260,Bodify Aloe Vera & Cucumber Body Wash & Bodify Bamboo Charcoal Body Wash,Bodify,Bath Body And Hair,Shower Gel,Refresh Shower Gel,Pittie Consumer Pvt. Ltd.,WH - Ambient,KnS,18
821998,Bodify Lemon & Rosemary Soap & Bodify Marine Extract Body Wash - 250ml,Bodify,Bath Body And Hair,Soap,Freshness Soap,Pittie Consumer Pvt. Ltd.,WH - Ambient,KnS,18
936697,Bodify Aloe Vera & Cucumber Soap & Bodify Lemon & Rosemary Soap,Bodify,Bath Body And Hair,Soap,Freshness Soap,Pittie Consumer Pvt. Ltd.,WH - Ambient,KnS,18
897266,Bodify Musk Fusion Soap & Bodify Aloe Vera & Cucumber Soap,Bodify,Bath Body And Hair,Soap,Freshness Soap,Pittie Consumer Pvt. Ltd.,WH - Ambient,KnS,18
992054,Mcaffeine Coffee Body Wash With Berries & Mcaffeine Coconut Cream Body Wash,Mcaffeine,Bath Body And Hair,Shower Gel,Refresh Shower Gel,Pep Technologies Pvt. Ltd.,WH - Ambient,KnS,18
127505,La French Luxure Oudh Perfume & Deodorant Unisex Long-Lasting Luxury Perfume Gift Set,La French,Bath Body And Hair,Gift Packs,Personal Care Gift,Saanvi Cosmetics Pvt Ltd,WH - Ambient,KnS,18
497899,La French Cuddle- Commit & Consent Perfume Gift Set For Women,La French,Bath Body And Hair,Gift Packs,Personal Care Gift,Saanvi Cosmetics Pvt Ltd,WH - Ambient,KnS,18
222358,La French Elegant Splendid- Opulent- Elegant & Luxe Perfume Gift Set,La French,Bath Body And Hair,Gift Packs,Personal Care Gift,Saanvi Cosmetics Pvt Ltd,WH - Ambient,KnS,18
285196,La French City Of Dreams Paris-Tokyo-New York & Rio Luxury Perfume Gift Set For Men,La French,Bath Body And Hair,Gift Packs,Personal Care Gift,Saanvi Cosmetics Pvt Ltd,WH - Ambient,KnS,18
741837,Plum Coconut Milk & Peptides Soft & Shiny Hair Duo Shampoo & Plum Onion & Biotin Hair Fall Control Shampoo,Plum,Bath Body And Hair,Shampoo And Conditioner,Shampoo,Pureplay Skin Sciences (India) Pvt. Ltd.,WH - Ambient,KnS,18
965857,Beardo Whisky Smoke Eau De Perfume & Beardo Men Black Musk Eau De Parfum,Beardo,Bath Body And Hair,"Perfumes, Deos And Talc",Perfumes,Zed Lifestyle Private Limited,WH - Ambient,KnS,18
835329,Beardo Whisky Smoke Eau De Perfume & Beardo De-Tan Face Wash Coffee Detox,Beardo,Bath Body And Hair,"Perfumes, Deos And Talc",Perfumes,Zed Lifestyle Private Limited,WH - Ambient,KnS,18
654758,Biotique Apricot Refreshing Body Wash & Biotique Basil & Parsley Revitalizing Body Wash,Biotique,Bath Body And Hair,Shower Gel,Refresh Shower Gel,Bioveda Farmacy Pvt Ltd,WH - Ambient,KnS,18
481144,"Beardo Godfather Eau De Parfum & Beardo Mini Perfume Trial Kit,10 X 5ml|Travel Friendly|Perfume Kit|Fragrance Gift For Men",Beardo,Bath Body And Hair,"Perfumes, Deos And Talc",Perfumes,Zed Lifestyle Private Limited,WH - Ambient,KnS,18
614508,Everyuth Naturals Anti Acne Anti Marks Tulsi Turmeric Face Wash & Everyuth Tan Removal Choco Cherry Pack,Everyuth,Bath Body And Hair,Face Wash And Scrub,Face Wash,Zydus Wellness Products Ltd.,WH - Ambient,KnS,18
748562,Skinn By Titan 24seven Floral Eau De Parfum Women & Skinn By Titan Raw Perfume For Men Edp,Skinn By Titan,Bath Body And Hair,"Perfumes, Deos And Talc",Perfumes,Titan Company Limited,WH - Ambient,KnS,18
883855,Moxie Beauty Gentle Cleansing Shampoo_50ml & Moxie Beauty Hyaluronic Acid Repairing Conditioner,Moxie Beauty,Bath Body And Hair,Shampoo And Conditioner,Shampoo,Beyoutiful Consumer Ventures Private Limited,WH - Ambient,KnS,18
320226,Khadi Natural Amla & Reetha Hair (Shampoo) | Prevents Dandruff & Khadi Natural Amla & Bhringraj Hair Cleanser Shampoo | Sls & Paraben Free,Khadi Natural,Bath Body And Hair,Shampoo And Conditioner,Shampoo,Khadi Natural Healthcare,WH - Ambient,KnS,18
752806,"Beardo Dandruff Control Sulphate Free Shampoo For Men Itchy Scalp | Menthol & Biotin & Beardo Beer Shampoo For Men |For Strong,Bouncy,Shiny Hair|Real Beer,Teatree,Aloe Vera",Beardo,Bath Body And Hair,Shampoo And Conditioner,Shampoo,Zed Lifestyle Private Limited,WH - Ambient,KnS,18
782868,Wishcare Niacinamide Oil Balance Sunscreen Spf 50 Pa++++ Light & Matte -For Oily Skin & Wishcare Ceramide Lip Balm With Spf50 Pa+++ - Kojic Acid & Niacinamide - For Lip Lightening & Protection,Wishcare,Bath Body And Hair,Face Cream,Sunscreen,Rabiko Lifestyle Pvt Limited,WH - Ambient,KnS,18
346097,Just Herbs Mint + Activated Charcoal Cooling Body Wash & Just Herbs The Hydraclean Bodywash Nourishing Body Milk Kit Spotless Skin Set For Men And Women,Just Herbs,Bath Body And Hair,Shower Gel,Cool Shower Gel,Marico Limited,WH - Ambient,KnS,18
771990,"Dettol Body Wash And Shower Gel,Lime Fresh & Dettol Body Wash And Shower Gel For Women And Men, Lavender Fresh",Dettol,Bath Body And Hair,Shower Gel,Body Wash,Reckitt Benckiser India Pvt Ltd,WH - Ambient,KnS,18
310508,Bella Vita Luxury White Oud Unisex Perfume For Men And Women & Bella Vita Luxury Organic Luxury Oud Experience Set,Bella Vita Organic,Bath Body And Hair,"Perfumes, Deos And Talc",Perfumes,Idam Naturals Wellness Pvt Ltd,WH - Ambient,KnS,18
161302,Aqualogica Illuminate+ Dewy Sunscreen Spf 50+ Pa++++ Wild Berries & Dr. Sheth's Haldi & Hyaluronic Acid Sunscreen,Aqualogica,Bath Body And Hair,Face Cream,Sunscreen,Honasa Consumer Pvt Ltd,WH - Ambient,KnS,18
642599,Himalaya Moisturizing Aloe Vera Face Wash & Himalaya Tan Removal Orange Face Wash,Himalaya,Bath Body And Hair,Face Wash And Scrub,Face Wash,Himalaya Wellness Company,WH - Ambient,KnS,18
988372,Santoor Sandal & Turmeric Soap & Jo Soap Lime & Glycerine Soap,Santoor,Bath Body And Hair,Soap,Sandal Soap,Wipro Enterprises Pvt Ltd,WH - Ambient,KnS,18
310644,"Arata 1% Salicylic Acid Body Wash & Arata 1% Salicylic Acid Exfoliating Body Wash For Body & Back Acne Prevents Dry, Rough, Bumpy, And Strawberry Skin Deep Cleanses Skin For All Skin Types Body Shower Gel",Arata,Bath Body And Hair,Shower Gel,Refresh Shower Gel,Slick Organics Private Limited,WH - Ambient,KnS,18
925709,Moxie Beauty Hyaluronic Acid Hair Serum & Moxie Beauty Gentle Cleansing Shampoo_50ml,Moxie Beauty,Bath Body And Hair,Hair Oil And Serum,Hair Serum,Beyoutiful Consumer Ventures Private Limited,WH - Ambient,KnS,18
100846,"Bella Vita Luxury Klub Man Eau De Parfum, Premium Long Lasting Perfume & Bella Vita Luxury Senorita Woman Body Mist",Bella Vita Organic,Bath Body And Hair,"Perfumes, Deos And Talc",Perfumes,Idam Naturals Wellness Pvt Ltd,WH - Ambient,KnS,18
541872,Dr. Sheth's Haldi & Hyaluronic Acid Sunscreen & Aqualogica Glow+Infused Tinted Sunscreen Papaya & Vitamin C - Spf 50+ Pa++++,Dr. Sheth's,Bath Body And Hair,Face Cream,Sunscreen,Honasa Consumer Pvt Ltd,WH - Ambient,KnS,18
643965,Neutrogena Ultra Sheer Dry Touch Sunblock Spf 50 Sunscreen & Neutrogena Ultra Sheer Spf50 Sunscreen,Neutrogena,Bath Body And Hair,Face Cream,Sunscreen,Jntl,WH - Ambient,KnS,18
811623,Cinthol Lime Talc - Anti-Perspirant - Germ Protection,Cinthol,Bath Body And Hair,"Perfumes, Deos And Talc",Talcum Powder,Godrej Consumer Products Limited,WH - Ambient,KnS,18
510047,"Beardo Bourbon Whisky Smoke Perfume For Men, | Oriental, Woody, Leathery | Long Lasting & Beardo Legend Perfume For Men | Eau De Parfum| Intense Fresh Woody | Strong Long Lasting",Beardo,Bath Body And Hair,"Perfumes, Deos And Talc",Perfumes,Zed Lifestyle Private Limited,WH - Ambient,KnS,18
608993,L'oreal Professionnel Scalp Advanced Anti-Dandruff Dermo-Clarifier Shampoo & L'oreal Professionnel Liss Unlimited Shampoo For Frizzy & Unruly Hair With Pro-Keratin,L'oreal Professionnel,Bath Body And Hair,Shampoo And Conditioner,Shampoo,L'oreal India Pvt Ltd,WH - Ambient,KnS,18
547519,Aqualogica Glow+Infused Tinted Sunscreen Papaya & Vitamin C - Spf 50+ Pa++++ & Pure Origin Korean Vitamin C Bright Boosting Light Gel Sunscreen No White Cast,Aqualogica,Bath Body And Hair,Face Cream,Sunscreen,Honasa Consumer Pvt Ltd,WH - Ambient,KnS,18
541876,Bblunt Intense Moisture Shampoo With Jojoba And Vitamin E & Bblunt Anti-Dandruff Shampoo For A Clear & Healthy Scalp,Bblunt,Bath Body And Hair,Shampoo And Conditioner,Shampoo,Honasa Consumer Pvt Ltd,WH - Ambient,KnS,18
